{"schema":"taxable-interest-composition.v1","id":"demo.composition.interest","version":"v1","constituents":[{"source_family":{"id":"demo.family.int-box1","version":"v1"},"authorizes_subtotal":"demo.interest.box1-subtotal"}],"required_universe":{"claim":"Declared positive taxable-interest families without adjustments."},"publishes":"demo.form1040.line2b","coextensiveness":"slot-bijection"}
